{
  "$id": "urn:fingrind:ledger1:node-staged-candidate",
  "$schema": "https://json-schema.org/draft/2020-12/schema",
  "properties": {
    "classification": {"const": "PUBLIC_SAFE"},
    "dependsOn": {"$ref": "urn:fingrind:ledger1:id-set"},
    "id": {"$ref": "urn:fingrind:ledger1:id"},
    "kind": {"const": "STAGED_CANDIDATE"},
    "payload": {"$ref": "urn:fingrind:ledger1:payload-staged-candidate"},
    "recommendedAfter": {"$ref": "urn:fingrind:ledger1:id-set"},
    "requiredForMilestones": {"$ref": "urn:fingrind:ledger1:id-set"},
    "schema": {"const": "urn:fingrind:ledger1:node-staged-candidate"}
  },
  "required": ["classification", "id", "schema", "dependsOn", "kind", "payload", "recommendedAfter", "requiredForMilestones"],
  "type": "object",
  "unevaluatedProperties": false,
  "x-fixture-required": true
}
